{
  "$schema": "https://raw.githubusercontent.com/peterbono/ai-design-system-demo/main/packages/core/audit-report.schema.json",
  "schemaVersion": 1,
  "tool": {
    "name": "bridge",
    "version": "0.1.0"
  },
  "label": "Bridge admin, after migration",
  "generatedAt": "2026-10-16T17:25:17.720Z",
  "target": {
    "path": "apps/admin/src",
    "files": 57,
    "skipped": 0
  },
  "designSystem": {
    "packages": [
      "@bridge-ds/react"
    ],
    "components": 46,
    "tokens": 535,
    "modes": [
      "brand=bridge,theme=light,density=comfortable",
      "brand=bridge,theme=light,density=compact",
      "brand=bridge,theme=dark,density=comfortable",
      "brand=bridge,theme=dark,density=compact",
      "brand=ocean,theme=light,density=comfortable",
      "brand=ocean,theme=light,density=compact",
      "brand=ocean,theme=dark,density=comfortable",
      "brand=ocean,theme=dark,density=compact"
    ]
  },
  "metrics": {
    "tokenAdoption": 100,
    "componentAdoption": 90.2,
    "tokenUsages": 445,
    "hardcoded": 0,
    "themeRefs": 0,
    "dsComponentInstances": 239,
    "uiComponentInstances": 265
  },
  "byCategory": {},
  "components": {
    "ds": {
      "Button": 12,
      "Table": 3,
      "TableHeader": 3,
      "TableRow": 7,
      "TableHead": 10,
      "Checkbox": 3,
      "TableBody": 3,
      "TableCell": 12,
      "Skeleton": 24,
      "TableEmpty": 1,
      "EmptyState": 9,
      "Select": 4,
      "Pagination": 2,
      "Breadcrumb": 1,
      "Input": 4,
      "Icon": 5,
      "IconButton": 4,
      "AlertDialog": 3,
      "AlertDialogContent": 3,
      "Card": 26,
      "Textarea": 1,
      "NumberField": 1,
      "Switch": 1,
      "Combobox": 3,
      "CardBody": 18,
      "CardHeader": 11,
      "Avatar": 5,
      "Inline": 1,
      "Badge": 9,
      "Link": 3,
      "Divider": 3,
      "Tabs": 4,
      "TabsList": 4,
      "Tab": 9,
      "TabsPanel": 4,
      "Drawer": 2,
      "DrawerContent": 2,
      "Progress": 1,
      "SidebarNavItem": 1,
      "SidebarNav": 1,
      "SidebarNavSection": 4,
      "Tooltip": 2,
      "Menu": 1,
      "MenuTrigger": 1,
      "MenuContent": 1,
      "MenuGroup": 1,
      "MenuRadioGroup": 1,
      "MenuRadioItem": 2,
      "MenuSeparator": 1,
      "MenuItem": 2
    },
    "foreign": {
      "ra-core": {
        "instances": 16,
        "components": {
          "LinkBase": 16
        }
      },
      "recharts": {
        "instances": 6,
        "components": {
          "AreaChart": 1,
          "CartesianGrid": 1,
          "XAxis": 1,
          "YAxis": 1,
          "Tooltip": 1,
          "Area": 1
        }
      }
    },
    "native": {
      "img": 3,
      "a": 1
    },
    "recreated": []
  },
  "topFiles": [
    {
      "path": "resources/dashboard/RevenueChart.tsx",
      "hardcoded": 0,
      "otherComponents": 6,
      "tokenUsages": 12,
      "dsComponents": 0
    },
    {
      "path": "resources/dashboard/Dashboard.tsx",
      "hardcoded": 0,
      "otherComponents": 3,
      "tokenUsages": 3,
      "dsComponents": 25
    },
    {
      "path": "ui/index.tsx",
      "hardcoded": 0,
      "otherComponents": 3,
      "tokenUsages": 0,
      "dsComponents": 7
    },
    {
      "path": "ra-bridge/DataTable.tsx",
      "hardcoded": 0,
      "otherComponents": 2,
      "tokenUsages": 5,
      "dsComponents": 21
    },
    {
      "path": "resources/customers/CustomerEdit.tsx",
      "hardcoded": 0,
      "otherComponents": 2,
      "tokenUsages": 0,
      "dsComponents": 14
    },
    {
      "path": "resources/products/ProductEdit.tsx",
      "hardcoded": 0,
      "otherComponents": 2,
      "tokenUsages": 0,
      "dsComponents": 14
    },
    {
      "path": "resources/products/ProductList.tsx",
      "hardcoded": 0,
      "otherComponents": 2,
      "tokenUsages": 3,
      "dsComponents": 16
    },
    {
      "path": "resources/categories/Categories.tsx",
      "hardcoded": 0,
      "otherComponents": 1,
      "tokenUsages": 0,
      "dsComponents": 9
    },
    {
      "path": "resources/invoices/Invoices.tsx",
      "hardcoded": 0,
      "otherComponents": 1,
      "tokenUsages": 0,
      "dsComponents": 18
    },
    {
      "path": "resources/orders/OrderEdit.tsx",
      "hardcoded": 0,
      "otherComponents": 1,
      "tokenUsages": 1,
      "dsComponents": 29
    },
    {
      "path": "resources/reviews/ReviewList.tsx",
      "hardcoded": 0,
      "otherComponents": 1,
      "tokenUsages": 0,
      "dsComponents": 12
    },
    {
      "path": "resources/segments/Segments.tsx",
      "hardcoded": 0,
      "otherComponents": 1,
      "tokenUsages": 0,
      "dsComponents": 4
    },
    {
      "path": "shell/AppShell.tsx",
      "hardcoded": 0,
      "otherComponents": 1,
      "tokenUsages": 0,
      "dsComponents": 28
    }
  ],
  "topFixes": [],
  "files": [
    {
      "path": "App.tsx",
      "lang": "tsx",
      "tokenUsages": 0,
      "themeRefs": 0,
      "hardcoded": 0,
      "dsComponents": 0,
      "otherComponents": 0,
      "findings": [],
      "components": []
    },
    {
      "path": "data/copy.ts",
      "lang": "ts",
      "tokenUsages": 0,
      "themeRefs": 0,
      "hardcoded": 0,
      "dsComponents": 0,
      "otherComponents": 0,
      "findings": [],
      "components": []
    },
    {
      "path": "data/dataProvider.ts",
      "lang": "ts",
      "tokenUsages": 0,
      "themeRefs": 0,
      "hardcoded": 0,
      "dsComponents": 0,
      "otherComponents": 0,
      "findings": [],
      "components": []
    },
    {
      "path": "data/persistence.ts",
      "lang": "ts",
      "tokenUsages": 0,
      "themeRefs": 0,
      "hardcoded": 0,
      "dsComponents": 0,
      "otherComponents": 0,
      "findings": [],
      "components": []
    },
    {
      "path": "format.ts",
      "lang": "ts",
      "tokenUsages": 0,
      "themeRefs": 0,
      "hardcoded": 0,
      "dsComponents": 0,
      "otherComponents": 0,
      "findings": [],
      "components": []
    },
    {
      "path": "i18n/en.ts",
      "lang": "ts",
      "tokenUsages": 0,
      "themeRefs": 0,
      "hardcoded": 0,
      "dsComponents": 0,
      "otherComponents": 0,
      "findings": [],
      "components": []
    },
    {
      "path": "i18n/fr.ts",
      "lang": "ts",
      "tokenUsages": 0,
      "themeRefs": 0,
      "hardcoded": 0,
      "dsComponents": 0,
      "otherComponents": 0,
      "findings": [],
      "components": []
    },
    {
      "path": "i18n/i18nProvider.ts",
      "lang": "ts",
      "tokenUsages": 0,
      "themeRefs": 0,
      "hardcoded": 0,
      "dsComponents": 0,
      "otherComponents": 0,
      "findings": [],
      "components": []
    },
    {
      "path": "main.tsx",
      "lang": "tsx",
      "tokenUsages": 0,
      "themeRefs": 0,
      "hardcoded": 0,
      "dsComponents": 0,
      "otherComponents": 0,
      "findings": [],
      "components": []
    },
    {
      "path": "preferences.tsx",
      "lang": "tsx",
      "tokenUsages": 0,
      "themeRefs": 0,
      "hardcoded": 0,
      "dsComponents": 0,
      "otherComponents": 0,
      "findings": [],
      "components": []
    },
    {
      "path": "ra-bridge/cx.ts",
      "lang": "ts",
      "tokenUsages": 0,
      "themeRefs": 0,
      "hardcoded": 0,
      "dsComponents": 0,
      "otherComponents": 0,
      "findings": [],
      "components": []
    },
    {
      "path": "ra-bridge/DataTable.tsx",
      "lang": "tsx",
      "tokenUsages": 5,
      "themeRefs": 0,
      "hardcoded": 0,
      "dsComponents": 21,
      "otherComponents": 2,
      "findings": [],
      "components": [
        {
          "line": 134,
          "column": 19,
          "name": "LinkBase",
          "kind": "foreign",
          "library": "ra-core",
          "suggestion": "Link"
        },
        {
          "line": 210,
          "column": 27,
          "name": "LinkBase",
          "kind": "foreign",
          "library": "ra-core",
          "suggestion": "Link"
        }
      ]
    },
    {
      "path": "ra-bridge/filters.tsx",
      "lang": "tsx",
      "tokenUsages": 0,
      "themeRefs": 0,
      "hardcoded": 0,
      "dsComponents": 5,
      "otherComponents": 0,
      "findings": [],
      "components": []
    },
    {
      "path": "ra-bridge/form.module.css",
      "lang": "css",
      "tokenUsages": 27,
      "themeRefs": 0,
      "hardcoded": 0,
      "dsComponents": 0,
      "otherComponents": 0,
      "findings": [],
      "components": []
    },
    {
      "path": "ra-bridge/forms.tsx",
      "lang": "tsx",
      "tokenUsages": 5,
      "themeRefs": 0,
      "hardcoded": 0,
      "dsComponents": 13,
      "otherComponents": 0,
      "findings": [],
      "components": []
    },
    {
      "path": "ra-bridge/index.ts",
      "lang": "ts",
      "tokenUsages": 0,
      "themeRefs": 0,
      "hardcoded": 0,
      "dsComponents": 0,
      "otherComponents": 0,
      "findings": [],
      "components": []
    },
    {
      "path": "ra-bridge/inputs.tsx",
      "lang": "tsx",
      "tokenUsages": 0,
      "themeRefs": 0,
      "hardcoded": 0,
      "dsComponents": 9,
      "otherComponents": 0,
      "findings": [],
      "components": []
    },
    {
      "path": "ra-bridge/layout.module.css",
      "lang": "css",
      "tokenUsages": 19,
      "themeRefs": 0,
      "hardcoded": 0,
      "dsComponents": 0,
      "otherComponents": 0,
      "findings": [],
      "components": []
    },
    {
      "path": "ra-bridge/list.module.css",
      "lang": "css",
      "tokenUsages": 41,
      "themeRefs": 0,
      "hardcoded": 0,
      "dsComponents": 0,
      "otherComponents": 0,
      "findings": [],
      "components": []
    },
    {
      "path": "ra-bridge/ListPagination.tsx",
      "lang": "tsx",
      "tokenUsages": 0,
      "themeRefs": 0,
      "hardcoded": 0,
      "dsComponents": 3,
      "otherComponents": 0,
      "findings": [],
      "components": []
    },
    {
      "path": "ra-bridge/Notifier.tsx",